"Symbol","Name","Last Trade","Type","Exchange"
"PCSVX","PACE Small/Medium Co Value Equity P","21.34","Mutual Fund","NAS"
"PAZCX","Putnam AZ Tax Exempt Income C","9.22","Mutual Fund","NAS"
"PATELENG.NS","Patel Engineering Ltd","76.65","Stock","NSI"
"PANAENERG.BO","Panasonic Energy India Co Ltd","353.1","Stock","BSE"
"PAM","Pampa Energia SA","22.11","Stock","NYQ"
"PAEMX","PIMCO Emerging Markets Bond A","9.70","Mutual Fund","NAS"
"ODY.AX","Odyssey Energy Limited","0.06","Stock","ASX"
"OAKBX","Oakmark Equity & Income I","31.36","Mutual Fund","NAS"
"NVDBX","Wells Fargo Advantage Diversified Eq B","28.82","Mutual Fund","NAS"
"NSIBX","Columbia Select Large Cap Equity Fund B","11.08","Mutual Fund","NAS"
"NSEIX","Nicholas Equity Income I","19.36","Mutual Fund","NAS"
"NS","NuStar Energy L.P.","39.01","Stock","NYQ"
"NRFAX","Natixis AEW Real Estate A","17.66","Mutual Fund","NAS"
"NOPRX","Nuveen Symphony Low Volatility Equity I","28.50","Mutual Fund","NAS"
"NLGCX","Columbia Global Strategic Equity C","12.70","Mutual Fund","NAS"
"NITESHEST.NS","Nitesh Estates Ltd","14.80","Stock","NSI"
"NIFTYEES-EQ.NS","EDELAMC NIFTYEES","8,010.00","Stock","NSI"
"NIFTYBEES.NS","Goldman Sachs Nifty BeES ETF","801.74","Stock","NSI"
"NIEAX","Dreyfus/Newton International Equity A","19.77","Mutual Fund","NAS"
"NIB","iPath Bloomberg Cocoa SubTR ETN","43.08","ETF","PCX"
"NFX","Newfield Exploration Co.","39.15","Stock","NYQ"
"NEMIX","Neuberger Berman Emerg Mkts Eq Instl","14.59","Mutual Fund","NAS"
"NEMCX","Neuberger Berman Emerg Mkts Eq C","14.01","Mutual Fund","NAS"
"NEMAX","Neuberger Berman Emerg Mkts Eq A","14.50","Mutual Fund","NAS"
"NEGCX","Natixis CGM Advisor Targeted Equity C","8.9","Mutual Fund","NAS"
"NEFGX","Natixis CGM Advisor Targeted Equity A","10.74","Mutual Fund","NAS"
"NEE","NextEra Energy, Inc.","100.57","Stock","NYQ"
"NBSBX","State Farm Equity & Bond B","11.32","Mutual Fund","NAS"
"NBL","Noble Energy, Inc.","36.99","Stock","NYQ"
"NBHRX","Neuberger Berman Equity Income R3","12.07","Mutual Fund","NAS"
"NAUKRI.BO","Info Edge (India) Ltd","878.35","Stock","BSE"
"MYCIX","Mainstay US Equity Opportunities I","9.11","Mutual Fund","NAS"
"MWEIX","MFS Global Equity I","36.97","Mutual Fund","NAS"
"MUEUX","MFS Blended Research Core Equity R4","23.36","Mutual Fund","NAS"
"MSIQX","Morgan Stanley Inst International Eq I","15.85","Mutual Fund","NAS"
"MSEFX","Litman Gregory Masters Equity Instl","18.42","Mutual Fund","NAS"
"MRLBX","Morgan Stanley Inst Global Real Est A","11.06","Mutual Fund","NAS"
"MNREX","Manning & Napier Real Estate S","15.88","Mutual Fund","NAS"
"MNECX","Manning & Napier Pro-Blend Extnd Term C","10.21","Mutual Fund","NAS"
"MMQYX","MassMutual Select Small Cap Val Eq Svc","16.22","Mutual Fund","NAS"
"MLVEX","BMO Low Volatility Equity I","13.33","Mutual Fund","NAS"
"MLSCX","Aberdeen Equity Long-Short C","6.38","Mutual Fund","NAS"
"MLIIX","BNY Mellon Intl Eq Income Investor","12.28","Mutual Fund","NAS"
"MIW","Eaton Vance Michigan Municipal Bond Fund","13.38","Stock","ASE"
"MIEDX","MassMutual Premier International Eq R5","12.5","Mutual Fund","NAS"
"MIECX","MainStay International Equity C","12.54","Mutual Fund","NAS"
"MGSEX","AMG Managers Special Equity Service","92.37","Mutual Fund","NAS"
"MGEMX","Morgan Stanley Inst Emerging Mkts I","20.59","Mutual Fund","NAS"
"MFOIX","BNY Mellon Focused Equity Opp Inv","15.57","Mutual Fund","NAS"
"MEQRX","MFS Global Equity R2","35","Mutual Fund","NAS"
"MEQPX","Morgan Stanley Inst Asian Equity A","9.68","Mutual Fund","NAS"
"MEQLX","Morgan Stanley Inst Asian Equity L","9.56","Mutual Fund","NAS"
"MENYX","Madison Covered Call & Equity Income Y","9.34","Mutual Fund","NAS"
"MEMHX","MFS Emerging Markets Equity R4","24.64","Mutual Fund","NAS"
"MEMBX","MFS Emerging Markets Equity B","22.98","Mutual Fund","NAS"
"MEI","Methode Electronics, Inc.","37.04","Stock","NYQ"
"MEG.TO","MEG Energy Corp.","10.97","Stock","TOR"
"MEFZX","MassMutual Select Mid Cap Gr Eq II I","20.17","Mutual Fund","NAS"
"MDEGX","BlackRock Long-Horizon Equity Inv A","12.93","Mutual Fund","NAS"
"MDEFX","BlackRock EuroFund Inv A","14.67","Mutual Fund","NAS"
"MDDCX","BlackRock Emerging Mkts Inv A","15.92","Mutual Fund","NAS"
"MCX.BO","MULTI COMMODITY EXCHANGE OF IN","867.35","Stock","BSE"
"MBRSX","AMG Managers Essex Sm/Micro Cap Gr Inv","27.24","Mutual Fund","NAS"
"MAWNX","MainStay Epoch US All Cap Inv","26.68","Mutual Fund","NAS"
"MAEFX","BlackRock EuroFund Instl","14.95","Mutual Fund","NAS"
"LZSMX","Lazard International Small Cap Eq Open","10.96","Mutual Fund","NAS"
"LZEMX","Lazard Emerging Markets Equity Instl","14.41","Mutual Fund","NAS"
"LZCOX","Lazard US Small-Mid Cap Equity Open","13.51","Mutual Fund","NAS"
"LWISX","Western Asset Emerging Markets Dbt IS","4.69","Mutual Fund","NAS"
"LWEAX","Western Asset Emerging Markets Dbt A","4.72","Mutual Fund","NAS"
"LSRYX","Emerald Small Cap Value Institutional","13.70","Mutual Fund","NAS"
"LSE.L","London Stock Exchange Group plc","2,673.00","Stock","LSE"
"LITIX","Lazard Global Realty Equity Instl","15.13","Mutual Fund","NAS"
"LISIX","Lazard International Strategic Eq Instl","13.87","Mutual Fund","NAS"
"LIESX","QS Batterymarch Intl Eq IS","15.02","Mutual Fund","NAS"
"LICYX","Lord Abbett Intl Core Equity I","12.73","Mutual Fund","NAS"
"LICQX","Lord Abbett Intl Core Equity R2","12.57","Mutual Fund","NAS"
"LGMSX","QS Batterymarch Emerging Mkts IS","16.06","Mutual Fund","NAS"
"LF","LeapFrog Enterprises Inc.","0.69","Stock","NYQ"
"LEE","Lee Enterprises, Incorporated","1.70","Stock","NYQ"
"LECO","Lincoln Electric Holdings Inc.","56.39","Stock","NMS"
"LDSYX","Lord Abbett Diversified Equity Strat I","19.86","Mutual Fund","NAS"
"LDSQX","Lord Abbett Diversified Equity Strat R2","19.90","Mutual Fund","NAS"
"LDMPX","Lord Abbett Emerging Markets Currency P","5.13","Mutual Fund","NAS"
"LDMOX","Lazard Developing Markets Equity Open","9.44","Mutual Fund","NAS"
"LCM","Advent/Claymore Enhanced Growth & Income Fund","8.51","Stock","NYQ"
"LBJ","Direxion Daily Latin America Bull 3X ETF","14.93","ETF","PCX"
"LAKSHMIO.BO","Lakshmi Energy & Foods Ltd","14.87","Stock","BSE"
"KREAX","Forward Real Estate A","17.5","Mutual Fund","NAS"
"KORU","Direxion Daily South Korea Bull 3X ETF","26.98","ETF","PCX"
"KDHRX","Deutsche CROCI Equity Dividend R","43.68","Mutual Fund","NAS"
"KDHAX","Deutsche CROCI Equity Dividend A","43.79","Mutual Fund","NAS"
"JRIEX","Janus International Equity R","11.93","Mutual Fund","NAS"
"JPECX","JPMorgan Tax Aware Equity C","29.99","Mutual Fund","NAS"
"JNUG","Direxion Daily Jr Gld Mnrs Bull 3X ETF","32.73","ETF","PCX"
"JMEZX","JPMorgan Market Expansion Enh Idx R2","12.82","Mutual Fund","NAS"
"JLCRX","JHancock Large Cap Equity R1","45.11","Mutual Fund","NAS"
"JFAMX","JPMorgan Emerging Mkts Eq A","19.32","Mutual Fund","NAS"
"JEPSX","JPMorgan US Research Equity Plus Select","22.41","Mutual Fund","NAS"
"JEMRX","JPMorgan Emerging Markets Debt R5","7.9","Mutual Fund","NAS"
"JEIZX","JPMorgan International Rsrch Enh Eq R2","16.23","Mutual Fund","NAS"
"JEECX","JPMorgan Emerging Economies C","10.8","Mutual Fund","NAS"
"JEC","Jacobs Engineering Group Inc.","44.96","Stock","NYQ"
"JCIEX","Janus International Equity C","11.88","Mutual Fund","NAS"
"JARIX","James Alpha Global Real Estate Invsmts I","19.57","Mutual Fund","NAS"
"IYITX","Ivy International Core Equity R","17.26","Mutual Fund","NAS"
"IYEYX","Ivy Tax-Managed Equity Y","20.41","Mutual Fund","NAS"
"IYECX","Ivy Tax-Managed Equity C","19.62","Mutual Fund","NAS"
"IYEAX","Ivy Tax-Managed Equity A","20.38","Mutual Fund","NAS"
"IXC","iShares Global Energy","31.68","ETF","PCX"
"IWDEX","Voya Diversified Emerging Markets Debt W","9.15","Mutual Fund","NAS"
"ITGSX","VY T. Rowe Price Growth Equity S","85.53","Mutual Fund","NAS"
"ITGIX","VY T. Rowe Price Growth Equity I","87.81","Mutual Fund","NAS"
"ITEAX","VY T. Rowe Price Equity Income A","13.68","Mutual Fund","NAS"
"ISGEX","Ivy Small Cap Growth E","18.22","Mutual Fund","NAS"
"IRGTX","VY Clarion Global Real Estate S","11.83","Mutual Fund","NAS"
"IRGIX","VY Clarion Global Real Estate I","11.89","Mutual Fund","NAS"
"INFRX","Advisory Research MLP & Energy Income A","9.22","Mutual Fund","NAS"
"INDZX","Columbia Diversified Equity Income A","13.97","Mutual Fund","NAS"
"INDOWIND.BO","Indowind Energy Ltd","4.68","Stock","BSE"
"INDEX","Index Funds S&P 500 Equal Weight No Load","24.88","Mutual Fund","NAS"
"IMNCX","Transamerica Global Equity C","11.08","Mutual Fund","NAS"
"IMNBX","Transamerica Global Equity B","11.09","Mutual Fund","NAS"
"IMCEX","Ivy Mid Cap Growth E","21.38","Mutual Fund","NAS"
"IMCDX","Voya Emerging Markets Corporate Debt P","9.42","Mutual Fund","NAS"
"ILCEX","Ivy Large Cap Growth E","20.00","Mutual Fund","NAS"
"ILCDX","Voya Emerging Markets Local Ccy Dbt P","7.01","Mutual Fund","NAS"
"IJSIX","VY JPMorgan Small Cap Core Equity I","18.62","Mutual Fund","NAS"
"IJSAX","VY JPMorgan Small Cap Core Equity A","17.73","Mutual Fund","NAS"
"IJEMX","VY JPMorgan Emerging Markets Equity I","14.23","Mutual Fund","NAS"
"IJEAX","VY JPMorgan Emerging Markets Equity A","13.61","Mutual Fund","NAS"
"IIDEX","Voya Diversified Emerging Markets Debt I","9.15","Mutual Fund","NAS"
"IIBEX","Ivy Global Income Allocation E","14.48","Mutual Fund","NAS"
"IHCSX","Voya Emerging Markets Hard Ccy Dbt P","9.18","Mutual Fund","NAS"
"IGLAX","Voya Global Real Estate A","19.89","Mutual Fund","NAS"
"IFCAX","Voya Emerging Markets Equity Dividend A","10.41","Mutual Fund","NAS"
"IEOAX","Ivy European Opportunities A","29.13","Mutual Fund","NAS"
"IEMAX","Invesco Emerging Markets Equity A","6.55","Mutual Fund","NAS"
"IE00B4YLN745.IR","Man GLG European Alpha Alt DN H GBP","11,855.00","Mutual Fund","ISE"
"IDJAX","Voya Euro STOXX 50 Index Port A","10.10","Mutual Fund","NAS"
"ICMAX","Intrepid Endurance Investor","13.83","Mutual Fund","NAS"
"ICENX","ICON Energy S","12.07","Mutual Fund","NAS"
"ICEIX","Ivy International Core Equity I","17.44","Mutual Fund","NAS"
"ICEEX","ICON Energy C","11.61","Mutual Fund","NAS"
"ICE","Intercontinental Exchange, Inc.","260.95","Stock","NYQ"
"IBVIX","Invesco Intl Core Equity R5","10.67","Mutual Fund","NAS"
"IASEX","Ivy Asset Strategy E","24.25","Mutual Fund","NAS"
"HSSIX","Emerald Banking and Finance Instl","34.49","Mutual Fund","NAS"
"HSRSX","Eagle Small Cap Growth R5","56.91","Mutual Fund","NAS"
"HPE","Hewlett Packard Enterprise Company","15.61","Stock","NYQ"
"HMRUX","Eagle Mid Cap Stock R6","30.27","Mutual Fund","NAS"
"HMN","Horace Mann Educators Corp.","35.2","Stock","NYQ"
"HLSAX","Hatteras Long / Short Equity A","9.39","Mutual Fund","NAS"
"HLRRX","REMS Real Estate Value Opportunity Instl","17.79","Mutual Fund","NAS"
"HLMVX","Harding Loevner Global Equity Inst","32.98","Mutual Fund","NAS"
"HLMGX","Harding Loevner Global Equity Advisor","32.91","Mutual Fund","NAS"
"HLMEX","Harding Loevner Instl Emerg Mkts I","15.87","Mutual Fund","NAS"
"HLEMX","Harding Loevner Emerging Markets Advisor","41.58","Mutual Fund","NAS"
"HLDCX","Hartford Emerging Markets Local Debt C","6.94","Mutual Fund","NAS"
"HINDOILEXP.BO","Hindustan Oil Exploration Co Ltd","36.35","Stock","BSE"
"HIGUX","Eagle Growth & Income R6","17.68","Mutual Fund","NAS"
"HIGHGROUND.BO","HIGH GROUND ENTERPRISE LTD","90.55","Stock","BSE"
"HHDFX","Hamlin High Dividend Equity Instl","19.8","Mutual Fund","NAS"
"HFEAX","Henderson European Focus A","34.62","Mutual Fund","NAS"
"HERSX","Hartford Emerging Markets Equity R4","7.14","Mutual Fund","NAS"
"HEQFX","Henssler Equity Investor","9.73","Mutual Fund","NAS"
"HEQCX","Henssler Equity Institutional","10.05","Mutual Fund","NAS"
"HEOZX","Highland Long/Short Equity Z","12.26","Mutual Fund","NAS"
"HEIFX","Hennessy Equity and Income Investor","16.32","Mutual Fund","NAS"
"HEFCX","Highland Energy MLP C","5.69","Mutual Fund","NAS"
"HECO","Huntington EcoLogical Strategy ETF","37.76","ETF","PCX"
"HCGAX","HSBC Emerging Markets Debt A","9.83","Mutual Fund","NAS"
"HAGAX","Eagle Mid Cap Growth A","43.98","Mutual Fund","NAS"
"GWMNX","AMG GW&K Municipal Enhanced Yield Inv","10.14","Mutual Fund","NAS"
"GWMEX","AMG GW&K Municipal Enhanced Yield Instl","10.13","Mutual Fund","NAS"
"GUSFX","RS Core Equity VIP Series","50.5","Mutual Fund","NAS"
"GTNRX","Invesco Global Low Volatility Eq Yld R","12.84","Mutual Fund","NAS"
"GTAYX","Invesco Mid Cap Core Equity Y","23.87","Mutual Fund","NAS"
"GTAVX","Invesco Mid Cap Core Equity R5","25.26","Mutual Fund","NAS"
"GTAGX","Invesco Mid Cap Core Equity A","23.57","Mutual Fund","NAS"
"GTACX","Invesco Mid Cap Core Equity C","16.57","Mutual Fund","NAS"
"GSY","Guggenheim Enhanced Short Dur ETF","49.94","ETF","PCX"
"GSSQX","Goldman Sachs US Equity Insights A","42.17","Mutual Fund","NAS"
"GSCYX","GuideStone Funds Small Cap Equity Instl","8.92","Mutual Fund","NAS"
"GSCKX","Goldman Sachs Strategic Intl Equity C","11.62","Mutual Fund","NAS"
"GRRAX","James Alpha Global Enh Real Ret A","10.10","Mutual Fund","NAS"
"GOLKONDA.BO","Golkonda Aluminium Extrusions","4.43","Stock","BSE"
"GOLDSHARE.NS","UTI Gold ETF","2,294.75","Stock","NSI"
"GOLDSHARE.BO","UTI Mutual Fund - UTI-Gold Exchange Traded Fund","2,284.30","Stock","BSE"
"GNDBX","Invesco Global Low Volatility Eq Yld B","12.12","Mutual Fund","NAS"
"GMCDX","GMO Emerging Country Debt III","9.32","Mutual Fund","NAS"
"GLRI","Glori Energy Inc.","0.80","Stock","NCM"
"GLDX","Global X Gold Explorers ETF","18.53","ETF","PCX"
"GLDC","Golden Enterprises Inc.","4.55","Stock","NGM"
"GIRCX","Goldman Sachs Intl Real Estate Sec C","6.33","Mutual Fund","NAS"
"GILBX","Lord Abbett Fundamental Equity B","11.18","Mutual Fund","NAS"
"GIFRX","Goldman Sachs Structured Intl Eq Flex R","10.03","Mutual Fund","NAS"
"GIEZX","GuideStone Funds International Eq Inv","14.10","Mutual Fund","NAS"
"GIEIX","GE Instl International Equity Inv","12.30","Mutual Fund","NAS"
"GIDCX","Goldman Sachs Intl Eq Div & Prem C","6.56","Mutual Fund","NAS"
"GGUIX","Aberdeen Equity Long-Short Inst","10.65","Mutual Fund","NAS"
"GGLIX","Aberdeen US Multi-Cap Equity Instl","13.42","Mutual Fund","NAS"
"GETFX","Ibbotson Growth ETF Asset Alloc","11.15","Mutual Fund","NAS"
"GERIX","Goldman Sachs Em Mkts Eq Insghts Intl","7.82","Mutual Fund","NAS"
"GEMCX","Goldman Sachs Emerging Markets Eq C","13.34","Mutual Fund","NAS"
"GEGCX","Aberdeen Emerging Markets C","11.93","Mutual Fund","NAS"
"GEDZX","GuideStone Funds Extended-Dur Bd Inv","17.37","Mutual Fund","NAS"
"GEDTX","GMO Emerging Domestic Opportunities II","21.59","Mutual Fund","NAS"
"GCTAX","Goldman Sachs US Tax-Managed Eq A","17.96","Mutual Fund","NAS"
"GCCEX","Gabelli Equity Income C","24.06","Mutual Fund","NAS"
"GAPRX","Goldman Sachs Equity Growth Strat R","14.9","Mutual Fund","NAS"
"GALQ.MC","GAM","0.26","Stock","MCE"
"FXG","First Trust Cnsmr Staples AlphaDEX ETF","44.02","ETF","PCX"
"FXA","CurrencyShares Australian Dollar ETF","73.28","ETF","PCX"
"FTPAX","First Investors Tax Exempt PA A","13.38","Mutual Fund","NAS"
"FTEMX","Fidelity Total Emerg Mkts","10.33","Mutual Fund","NAS"
"FTEJX","Fidelity Advisor Total Emerg Mkts I","10.32","Mutual Fund","NAS"
"FTEIX","Fidelity Advisor Total Intl Equity I","7.81","Mutual Fund","NAS"
"FTBEX","Fidelity Advisor Total Intl Equity B","7.86","Mutual Fund","NAS"
"FTAEX","Fidelity Advisor Total Intl Equity A","7.81","Mutual Fund","NAS"
"FSLEX","Fidelity Select Envir and Alt Engy Port","19.97","Mutual Fund","NAS"
"FSGDX","Fidelity Spartan Glb ex USIdxAdvtg","11.26","Mutual Fund","NAS"
"FSAMX","Strategic Advisers Emerging Markets","8.07","Mutual Fund","NAS"
"FRESX","Fidelity Real Estate Investment Port","41.03","Mutual Fund","NAS"
"FPMIX","Fidelity Spartan EMkts Idx Instl","8.25","Mutual Fund","NAS"
"FONE","First Trust NASDAQ CEA Smartphone ETF","37.73","ETF","PCX"
"FMTNX","First Investors Tax Exempt NC A","13.71","Mutual Fund","NAS"
"FMEAX","Fidelity Advisor EMEA A","7.2","Mutual Fund","NAS"
"FLGEX","Fidelity Large Cap Growth Enhanced Idx","15.47","Mutual Fund","NAS"
"FKEMX","Fidelity Emerging Markets K","22.51","Mutual Fund","NAS"
"FIUUX","First Investors Equity Income Advisor","9.77","Mutual Fund","NAS"
"FITAX","First Investors Tax Exempt Inc A","9.87","Mutual Fund","NAS"
"FIMGX","First Investors Tax Exempt MA B","12.04","Mutual Fund","NAS"
"FIMAX","First Investors Tax Exempt MA A","12.07","Mutual Fund","NAS"
"FIEMX","Fidelity Advisor EMEA I","7.21","Mutual Fund","NAS"
"FICAX","First Investors Tax Exempt CA A","12.97","Mutual Fund","NAS"
"FGROX","Emerald Growth Institutional","20.98","Mutual Fund","NAS"
"FEXKX","Fidelity Export & Multinational K","20.87","Mutual Fund","NAS"
"FET","Forum Energy Technologies, Inc.","15.6","Stock","NYQ"
"FESOX","First Eagle Overseas C","21.64","Mutual Fund","NAS"
"FENIX","Forward Equity Long/Short Institutional","24.26","Mutual Fund","NAS"
"FEN","First Trust Energy Income and Growth Fund","22.73","Stock","ASE"
"FEGOX","First Eagle Gold C","11.07","Mutual Fund","NAS"
"FEDFX","Fidelity Series Emerging Mkts Debt F","9.48","Mutual Fund","NAS"
"FEATX","Fidelity Advisor Emerging Asia T","27.72","Mutual Fund","NAS"
"FEAAX","Fidelity Advisor Emerging Asia A","28.54","Mutual Fund","NAS"
"FDMTX","Fidelity Advisor Communications Equip T","11","Mutual Fund","NAS"
"ASKE","Alaska Pacific Energy Corp.","0","Stock","PNK"
"FDEQX","Fidelity Disciplined Equity","34.84","Mutual Fund","NAS"
"FCEL.BO","FUTURE CONSUMER ENTERPRISE LIM","23.15","Stock","BSE"
"FBPEX","FBP Equity & Dividend Plus","23.03","Mutual Fund","NAS"
"FBEMX","Fidelity Advisor Emerging Mkts Inc B","13.32","Mutual Fund","NAS"
"FAS","Direxion Daily Financial Bull 3X ETF","32.57","ETF","PCX"
"FANG","Diamondback Energy, Inc.","78.2","Stock","NMS"
"FANAX","Fidelity Advisor Energy A","31.07","Mutual Fund","NAS"
"FAKSX","Frost Mid Cap Equity Investor","12.65","Mutual Fund","NAS"
"FAGNX","Fidelity Advisor Energy T","31.78","Mutual Fund","NAS"
"FADSX","Nuveen Equity Index R3","28.76","Mutual Fund","NAS"
"FACEX","Frost Growth Equity Investor","15.61","Mutual Fund","NAS"
"EYTGX","Eaton Vance Tx-Mgd Growth 1.2 B","18.09","Mutual Fund","NAS"
"EXPE","Expedia Inc.","125.04","Stock","NMS"
"EXPD","Expeditors International of Washington Inc.","48.91","Stock","NMS"
"EXNYX","Eaton Vance NY Ltd Maturity Muni Inc A","10.03","Mutual Fund","NAS"
"EXIDEIND.BO","Exide Industries Ltd","145.2","Stock","BSE"
"EXFLX","Eaton Vance Floating-Rate Muni Inc A","9.81","Mutual Fund","NAS"
"EXDVX","Manning & Napier Diversified Tax Exempt","11.09","Mutual Fund","NAS"
"EXCRX","Manning & Napier Core Bond S","10.69","Mutual Fund","NAS"
"EXC","Exelon Corporation","27.85","Stock","NYQ"
"EWZ","iShares MSCI Brazil Capped","22.58","ETF","PCX"
"EWY","iShares MSCI South Korea Capped","53.74","ETF","PCX"
"EWS","iShares MSCI Singapore","10.65","ETF","PCX"
"EWEIX","Wells Fargo Advantage Intrns Wld Eq Adm","22.91","Mutual Fund","NAS"
"EVTMX","Eaton Vance Dividend Builder A","14.38","Mutual Fund","NAS"
"EVSIX","Wells Fargo Advantage Discp US Core I","15.82","Mutual Fund","NAS"
"EVR","Evercore Partners Inc.","56.13","Stock","NYQ"
"EVORX","Eaton Vance OR Municipal Income B","9.53","Mutual Fund","NAS"
"EVOL","Evolving Systems Inc.","5.75","Stock","NCM"
"EVOIX","Altegris Futures Evolution Strategy I","11.36","Mutual Fund","NAS"
"EVHYX","Eaton Vance High-Yield Municipal Inc B","8.8","Mutual Fund","NAS"
"EVGAX","Eaton Vance GA Municipal Income B","9.22","Mutual Fund","NAS"
"EVEREADY.NS","Eveready Industries India Ltd","290.4","Stock","NSI"
"EVBLX","Eaton Vance Floating Rate A","8.82","Mutual Fund","NAS"
"EVBIX","Eaton Vance Bond I","9.15","Mutual Fund","NAS"
"EURN","Euronav NV","13.1","Stock","NYQ"
"EUO","ProShares UltraShort Euro","26.78","ETF","PCX"
"ETR","Entergy Corporation","67.39","Stock","NYQ"
"ETN","Eaton Corporation plc","58.45","Stock","NYQ"
"ETILX","Eventide Gilead I","26.87","Mutual Fund","NAS"
"ETFVX","Stadion Managed Risk 100 I","8.86","Mutual Fund","NAS"
"ETFOX","Stadion Tactical Growth I","10.27","Mutual Fund","NAS"
"ETFC","E*TRADE Financial Corporation","30.72","Stock","NMS"
"ETEGX","Eaton Vance Small-Cap A","14.47","Mutual Fund","NAS"
"ET.TO","Evertz Technologies Limited","16.35","Stock","TOR"
"ESVAX","Eaton Vance Tax-Managed Global Sm-Cp A","11.38","Mutual Fund","NAS"
"ESSAROIL.NS","Essar Oil Ltd","215.35","Stock","NSI"
"ESPIX","Wells Fargo Advantage Spec SmCp Val Adm","29.07","Mutual Fund","NAS"
"ESPCX","Wells Fargo Advantage Spec SmCp Val C","25.86","Mutual Fund","NAS"
"ESPBX","Wells Fargo Advantage Spec SmCp Val B","25.74","Mutual Fund","NAS"
"ESP","Espey Mfg. & Electronics Corp.","25.02","Stock","ASE"
"ESP.TO","Espial Group, Inc.","2.39","Stock","TOR"
"ESIVX","Wells Fargo Advantage Intl Bond C","9.33","Mutual Fund","NAS"
"ESIDX","Wells Fargo Advantage Intl Bond Adm","9.5","Mutual Fund","NAS"
"ESCIX","Ashmore Emerging Markets Sm Cp Eq Instl","10.31","Mutual Fund","NAS"
"ERY","Direxion Daily Energy Bear 3X ETF","21.63","ETF","PCX"
"ERX","Direxion Daily Energy Bull 3X ETF","34.64","ETF","PCX"
"ERSIX","Eaton Vance Short Duration Strat Inc R","7.34","Mutual Fund","NAS"
"ERHSX","Eaton Vance Worldwide Health Sci R","13.95","Mutual Fund","NAS"
"ERBCX","Eaton Vance Richard Bernstein Eq Strat C","14.48","Mutual Fund","NAS"
"ERB","ERBA Diagnostics, Inc.","1.72","Stock","ASE"
"ERA","Era Group Inc.","11.96","Stock","NYQ"
"EQNUX","MFS Equity Income R4","13.42","Mutual Fund","NAS"
"EQC","Equity Commonwealth","27.81","Stock","NYQ"
"EPVNX","Epiphany FFV A","11.8","Mutual Fund","NAS"
"EPP","iShares MSCI Pacific ex Japan","39.76","ETF","PCX"
"EPLPX","MainStay Epoch US Equity Yield A","14.07","Mutual Fund","NAS"
"EPLCX","MainStay Epoch US Equity Yield I","14.19","Mutual Fund","NAS"
"EPLAX","EP Latin America A","9","Mutual Fund","NAS"
"EPIEX","MainStay Epoch International Sm Cp I","22.26","Mutual Fund","NAS"
"EPGCX","Fidelity Advisor Equity Growth C","89.18","Mutual Fund","NAS"
"EPE","EP Energy Corporation","5.65","Stock","NYQ"
"EOMYX","Wells Fargo Advantage Omega Growth Adm","49.95","Mutual Fund","NAS"
"ENLK","EnLink Midstream Partners, LP","14.91","Stock","NYQ"
"ENB","Enbridge Inc.","36.09","Stock","NYQ"
"EMPO","Empowered Products, Inc.","0.01","Stock","PNK"
"EMN","Eastman Chemical Co.","72.54","Stock","NYQ"
"EMMOX","Lazard Emerging Markets Multi Asset Open","7.86","Mutual Fund","NAS"
"EMIVX","MFS Massachusetts Investors Gr Stk 529B","22.01","Mutual Fund","NAS"
"EMHSX","Eaton Vance Worldwide Health Sci B","13.59","Mutual Fund","NAS"
"EMGRX","Nuveen Small Cap Select A","11.47","Mutual Fund","NAS"
"EMGIX","Eaton Vance Greater India B","22.83","Mutual Fund","NAS"
"EMFYX","UBS Emerging Markets Debt Fd Cl","8.05","Mutual Fund","NAS"
"EMES","Emerge Energy Services LP","6.81","Stock","NYQ"
"EMCO.BO","EMCo Ltd","31.05","Stock","BSE"
"EMC","EMC Corporation","25.54","Stock","NYQ"
"EMACX","Gabelli Entpr Mergers & Acquisitions C","12.23","Mutual Fund","NAS"
"ELRN","Greenwood Hall, Inc.","0.19","Stock","PNK"
"ELRC","Electro Rent Corporation","10.77","Stock","NMS"
"ELPROINTL.BO","ELPRO INTERNATIONAL LTD.","51.3","Stock","BSE"
"ELNET.BO","Elnet Technologies Ltd","99.9","Stock","BSE"
"ELEMARB.BO","Elegant Marbles & Grani Industries Ltd","88.75","Stock","BSE"
"ELECON.NS","Elecon Engineering Co Ltd","87.35","Stock","NSI"
"ELDERPHAR.NS","Elder Pharmaceuticals Ltd","90.45","Stock","NSI"
"ELCRX","Eaton Vance Growth R","22.68","Mutual Fund","NAS"
"ELBIX","Ashmore Emerging Mkts Lcl Ccy Bd Instl","6.66","Mutual Fund","NAS"
"ELBCX","Ashmore Emerging Mkts Lcl Ccy Bd C","6.42","Mutual Fund","NAS"
"ELANX","Epiphany FFV Latin America N","7.39","Mutual Fund","NAS"
"EKWBX","Wells Fargo Advantage Precious Metals B","21.52","Mutual Fund","NAS"
"EKORX","Wells Fargo Advantage Omega Growth R","45.44","Mutual Fund","NAS"
"EKHBX","Wells Fargo Advantage High Yld Bd B","3.11","Mutual Fund","NAS"
"EKC.BO","Everest Kanto Cylinder Ltd","11.09","Stock","BSE"
"EKBYX","Wells Fargo Advantage Divers Cptl Bldr I","9.5","Mutual Fund","NAS"
"EIVTX","Wells Fargo Advantage Intrinsic Val R","13.66","Mutual Fund","NAS"
"EIVIX","Wells Fargo Advantage Intrinsic Val I","13.69","Mutual Fund","NAS"
"EIVCX","Wells Fargo Advantage Intrinsic Val C","13.29","Mutual Fund","NAS"
"EIMDX","Eaton Vance MD Municipal Income I","9.05","Mutual Fund","NAS"
"EIMAX","Eaton Vance MA Municipal Income I","9.08","Mutual Fund","NAS"
"EIHMX","Eaton Vance National Municipal Income I","9.88","Mutual Fund","NAS"
"EIGI","Endurance International Group Holdings, Inc.","13.91","Stock","NMS"
"EICTX","Eaton Vance CT Municipal Income I","10.3","Mutual Fund","NAS"
"EIBLX","Eaton Vance Floating Rate I","8.53","Mutual Fund","NAS"
"EIAMX","Eaton Vance Multi-Strategy All Mkt I","9.89","Mutual Fund","NAS"
"EHUIX","Eaton Vance Hexavest US Equity I","10.47","Mutual Fund","NAS"
"EHTH","eHealth, Inc.","12.92","Stock","NMS"
"EGWAX","Wells Fargo Advantage Trdtl Sm Cp Gr A","16.98","Mutual Fund","NAS"
"EGRRX","Eaton Vance Glbl Macro Abs Ret Advtg R","10.14","Mutual Fund","NAS"
"EGHT","8x8 Inc.","11.32","Stock","NMS"
"SUNILHITEC-BE.NS","SUNIL HITECH ENGIN INR10","0","Stock","NSI"
"EGBLX","Eagle Investment Grade Bond I","14.87","Mutual Fund","NAS"
"EFPL.BO","ECO FRIENDLY FOOD PROCESSING P","31.75","Stock","BSE"
"EFO","ProShares Ultra MSCI EAFE","96.05","ETF","PCX"
"EFC","Ellington Financial LLC","17.4","Stock","NYQ"
"EET","ProShares Ultra MSCI Emerging Markets","49.42","ETF","PCX"
"EEI","Ecology & Environment, Inc.","10.68","Stock","NGM"
"EDU","New Oriental Education & Technology Group Inc.","30.63","Stock","NYQ"
"EDL.BO","Empee Distilleries Ltd","78.6","Stock","BSE"
"EDELWEISS.BO","Edelweiss Financial Services Ltd","59.2","Stock","BSE"
"EDE","The Empire District Electric Company","22.94","Stock","NYQ"
"ED","Consolidated Edison, Inc.","62.59","Stock","NYQ"
"ECVSX","Eaton Vance Global Small-Cap C","11","Mutual Fund","NAS"
"ECTVX","Eaton Vance Tx-Mgd Value C","22.46","Mutual Fund","NAS"
"ECRAX","Eaton Vance Rich Bern All Asst Strat C","12.46","Mutual Fund","NAS"
"ECR","Eclipse Resources Corporation","2.54","Stock","NYQ"
"ECMAX","MFS Moderate Allocation 529C","16.35","Mutual Fund","NAS"
"ECH","iShares MSCI Chile Capped","32.22","ETF","PCX"
"ECGMX","Eaton Vance Glbl Macr Absolute Return C","9.2","Mutual Fund","NAS"
